
Bus 003 Device 106: ID 1d6b:0104 Linux Foundation Multifunction Composite Gadget
Device Descriptor:
  bLength                18
  bDescriptorType         1
  bcdUSB               2.00
  bDeviceClass            0 [unknown]
  bDeviceSubClass         0 [unknown]
  bDeviceProtocol         0 
  bMaxPacketSize0        64
  idVendor           0x1d6b Linux Foundation
  idProduct          0x0104 Multifunction Composite Gadget
  bcdDevice            1.00
  iManufacturer           1 HP
  iProduct                2 webOS Device (novacom-test)
  iSerial                 3 touchpad-novacom-01
  bNumConfigurations      1
OTG Descriptor:
  bLength                 3
  bDescriptorType         9
  bmAttributes         0x03
    SRP (Session Request Protocol)
    HNP (Host Negotiation Protocol)
  Configuration Descriptor:
    bLength                 9
    bDescriptorType         2
    wTotalLength       0x0072
    bNumInterfaces          3
    bConfigurationValue     1
    iConfiguration          4 ECM + Novacom
    bmAttributes         0x80
      (Bus Powered)
    MaxPower              250mA
    Interface Association:
      bLength                 8
      bDescriptorType        11
      bFirstInterface         0
      bInterfaceCount         2
      bFunctionClass          2 Communications
      bFunctionSubClass       6 Ethernet Networking
      bFunctionProtocol       0 
      iFunction               8 CDC ECM
    Interface Descriptor:
      bLength                 9
      bDescriptorType         4
      bInterfaceNumber        0
      bAlternateSetting       0
      bNumEndpoints           1
      bInterfaceClass         2 Communications
      bInterfaceSubClass      6 Ethernet Networking
      bInterfaceProtocol      0 
      iInterface              5 CDC Ethernet Control Model (ECM)
      CDC Header:
        bcdCDC               1.10
      CDC Union:
        bMasterInterface        0
        bSlaveInterface         1 
      CDC Ethernet:
        iMacAddress                      6 AEC76A09CB4B
        bmEthernetStatistics    0x00000000
        wMaxSegmentSize               1514
        wNumberMCFilters            0x0000
        bNumberPowerFilters              0
      Endpoint Descriptor:
        bLength                 7
        bDescriptorType         5
        bEndpointAddress     0x82  EP 2 IN
        bmAttributes            3
          Transfer Type            Interrupt
          Synch Type               None
          Usage Type               Data
        wMaxPacketSize     0x0010  1x 16 bytes
        bInterval               9
    Interface Descriptor:
      bLength                 9
      bDescriptorType         4
      bInterfaceNumber        1
      bAlternateSetting       0
      bNumEndpoints           0
      bInterfaceClass        10 CDC Data
      bInterfaceSubClass      0 [unknown]
      bInterfaceProtocol      0 
      iInterface              0 
    Interface Descriptor:
      bLength                 9
      bDescriptorType         4
      bInterfaceNumber        1
      bAlternateSetting       1
      bNumEndpoints           2
      bInterfaceClass        10 CDC Data
      bInterfaceSubClass      0 [unknown]
      bInterfaceProtocol      0 
      iInterface              7 CDC Ethernet Data
      Endpoint Descriptor:
        bLength                 7
        bDescriptorType         5
        bEndpointAddress     0x81  EP 1 IN
        bmAttributes            2
          Transfer Type            Bulk
          Synch Type               None
          Usage Type               Data
        wMaxPacketSize     0x0200  1x 512 bytes
        bInterval               0
      Endpoint Descriptor:
        bLength                 7
        bDescriptorType         5
        bEndpointAddress     0x01  EP 1 OUT
        bmAttributes            2
          Transfer Type            Bulk
          Synch Type               None
          Usage Type               Data
        wMaxPacketSize     0x0200  1x 512 bytes
        bInterval               0
    Interface Descriptor:
      bLength                 9
      bDescriptorType         4
      bInterfaceNumber        2
      bAlternateSetting       0
      bNumEndpoints           2
      bInterfaceClass       255 Vendor Specific Class
      bInterfaceSubClass     71 [unknown]
      bInterfaceProtocol     17 
      iInterface             10 Novacom
      Endpoint Descriptor:
        bLength                 7
        bDescriptorType         5
        bEndpointAddress     0x83  EP 3 IN
        bmAttributes            2
          Transfer Type            Bulk
          Synch Type               None
          Usage Type               Data
        wMaxPacketSize     0x0200  1x 512 bytes
        bInterval               0
      Endpoint Descriptor:
        bLength                 7
        bDescriptorType         5
        bEndpointAddress     0x02  EP 2 OUT
        bmAttributes            2
          Transfer Type            Bulk
          Synch Type               None
          Usage Type               Data
        wMaxPacketSize     0x0200  1x 512 bytes
        bInterval               0
Device Qualifier (for other device speed):
  bLength                10
  bDescriptorType         6
  bcdUSB               2.00
  bDeviceClass            0 [unknown]
  bDeviceSubClass         0 [unknown]
  bDeviceProtocol         0 
  bMaxPacketSize0        64
  bNumConfigurations      1
Device Status:     0x0000
  (Bus Powered)
